{"type":"config","name":"Bundle Size Optimization","metricName":"total_kb","metricUnit":"kb","bestDirection":"lower"}
{"run":1,"commit":"995faad","metric":1456,"metrics":{},"status":"keep","description":"Baseline — 1456 KB total JS bundle","timestamp":1777638959024,"segment":0,"confidence":null,"asi":{"hypothesis":"baseline measurement","total_kb":1456,"top_chunks":"224=224KB, 3054666c=196KB, framework=188KB, 34=184KB, main=132KB"}}
{"run":2,"commit":"995faad","metric":1456,"metrics":{},"status":"discard","description":"modularizeImports for lucide-react — no change, already tree-shaken","timestamp":1777639067892,"segment":0,"confidence":null,"asi":{"hypothesis":"lucide-react modularizeImports would reduce bundle","result":"no effect, likely already tree-shaken by Next.js"}}
{"run":3,"commit":"995faad","metric":1456,"metrics":{},"status":"discard","description":"remove react-qr-code unused dep — no bundle change","timestamp":1777639151293,"segment":0,"confidence":null,"asi":{"hypothesis":"remove unused react-qr-code from deps","result":"no effect on bundle, was already tree-shaken out"}}
{"run":4,"commit":"995faad","metric":1448,"metrics":{},"status":"discard","description":"stub auth-client — 8KB reduction but breaks ConvexBetterAuthProvider prerender","timestamp":1777639393832,"segment":0,"confidence":null,"asi":{"hypothesis":"stub out better-auth client to remove from bundle","result":"too invasive — ConvexBetterAuthProvider internally needs useSession, signIn.social etc. Build fails at prerender stage","reduction":"8 KB (1456->1448)","problem":"Cannot safely stub auth client without mocking full better-auth API surface"}}
{"run":5,"commit":"4d5d628","metric":1456,"metrics":{},"status":"discard","description":"compress: true — no effect on static bundle size","timestamp":1777639447416,"segment":0,"confidence":null,"asi":{"hypothesis":"compress: true would reduce JS file sizes","result":"compress only affects HTTP response compression, not static file sizes"}}
{"run":6,"commit":"8fc9cd7","metric":1336,"metrics":{},"status":"keep","description":"experimental.optimizePackageImports — 120KB reduction (-8.2%)","timestamp":1777639522064,"segment":0,"confidence":null,"asi":{"hypothesis":"optimizePackageImports for heavy packages (lucide-react, better-auth, radix, etc)","result":"120 KB reduction (1456->1336, -8.2%)","new_top_chunk":"826=224KB was 224=224KB before (better-auth), 3054666c=196KB unchanged (react), framework=188KB unchanged"}}
{"run":7,"commit":"8fc9cd7","metric":1336,"metrics":{},"status":"discard","description":"swcMinify — deprecated in Next.js 16","timestamp":1777639605419,"segment":0,"confidence":null,"asi":{"hypothesis":"swcMinify would improve minification","result":"swcMinify removed in Next.js 16, already default"}}
{"run":8,"commit":"8fc9cd7","metric":1336,"metrics":{},"status":"discard","description":"more optimizePackageImports — no additional reduction","timestamp":1777639679612,"segment":0,"confidence":30,"asi":{"hypothesis":"add more packages to optimizePackageImports (hookform, zod, next-themes, tailwind-merge)","result":"no additional reduction, packages already tree-shaken"}}
{"run":9,"commit":"e7af896","metric":1340,"metrics":{},"status":"discard","description":"webpack splitChunks for better-auth — build error, no size benefit","timestamp":1777639893080,"segment":0,"confidence":15,"asi":{"hypothesis":"webpack splitChunks to separate better-auth into its own chunk","result":"build error (duplicate type), splitChunks doesn't reduce total size anyway - just reshuffles chunks"}}
{"run":10,"commit":"c32a305","metric":1328,"metrics":{},"status":"keep","description":"reactCompiler: false + clean up webpack junk — 1328KB (-8KB from best)","timestamp":1777640045905,"segment":0,"confidence":2.1333333333333333,"asi":{"hypothesis":"reactCompiler: false would remove compiler runtime overhead from bundle","result":"8KB reduction (1336->1328), also cleaned up leftover webpack config junk from previous failed experiment"}}
{"run":11,"commit":"c32a305","metric":1328,"metrics":{},"status":"discard","description":"cacheComponents: false — no change","timestamp":1777640084027,"segment":0,"confidence":10.666666666666666,"asi":{"hypothesis":"cacheComponents: false might reduce client bundle","result":"no effect, same 1328KB"}}
{"run":12,"commit":"c32a305","metric":1328,"metrics":{},"status":"discard","description":"optimizePackageImports @better-fetch/fetch — no change","timestamp":1777640142798,"segment":0,"confidence":12.8,"asi":{"hypothesis":"add @better-fetch/fetch to optimizePackageImports","result":"no change, already optimized by better-auth entry"}}
{"run":13,"commit":"f01be7c","metric":1328,"metrics":{},"status":"keep","description":"verification run — 1328KB confirmed stable","timestamp":1777640382512,"segment":0,"confidence":16,"asi":{"hypothesis":"verification run to confirm 1328KB is stable","result":"confirmed stable at 1328KB, no noise variance"}}
{"run":14,"commit":"f01be7c","metric":0,"metrics":{},"status":"crash","description":"ppr: incremental — merged into cacheComponents in Next.js 16","timestamp":1777640475391,"segment":0,"confidence":16,"asi":{"hypothesis":"experimental.ppr: incremental would enable PPR and reduce JS","result":"PPR merged into cacheComponents in Next.js 16 — already enabled"}}
{"run":15,"commit":"f01be7c","metric":1328,"metrics":{},"status":"discard","description":"inlineCss: true — no change","timestamp":1777640521716,"segment":0,"confidence":16,"asi":{"hypothesis":"inlineCss: true would reduce JS by inlining styles","result":"no change, CSS already separate from JS"}}
{"run":16,"commit":"f01be7c","metric":1328,"metrics":{},"status":"discard","description":"optimizeCss: true — no JS change","timestamp":1777640564546,"segment":0,"confidence":16,"asi":{"hypothesis":"optimizeCss: true for Tailwind CSS optimization","result":"no JS change, CSS optimization doesn't affect JS bundle"}}
{"run":17,"commit":"f01be7c","metric":1328,"metrics":{},"status":"discard","description":"remove turbopack config — no effect on production build","timestamp":1777640654611,"segment":0,"confidence":16,"asi":{"hypothesis":"removing turbopack config from next.config might reduce production bundle","result":"no effect, turbopack config only used in dev mode"}}
{"run":18,"commit":"f01be7c","metric":1328,"metrics":{},"status":"discard","description":"output: standalone — no JS change (server-only optimization)","timestamp":1777640703642,"segment":0,"confidence":16,"asi":{"hypothesis":"output: standalone might enable more aggressive tree-shaking","result":"no change, standalone only affects server-side dependency tracing"}}
{"run":19,"commit":"f01be7c","metric":1336,"metrics":{},"status":"discard","description":"lazy load authClient — +8KB worse (lazy overhead, no reduction)","timestamp":1777640832047,"segment":0,"confidence":16,"asi":{"hypothesis":"lazy load authClient via React.lazy + Suspense to defer better-auth","result":"+8KB worse (1328->1336). Lazy loading doesn't reduce total — just adds Suspense boundary overhead. Chunks still all exist."}}
{"run":20,"commit":"f01be7c","metric":1328,"metrics":{},"status":"discard","description":"delete 13 unused UI components — no change (already tree-shaken)","timestamp":1777640887142,"segment":0,"confidence":16,"asi":{"hypothesis":"delete 13 unused UI component files (alert-dialog, dialog, form, drawer, sonner, etc) to remove from module graph","result":"no change, tree-shaking was already perfect — unused files had zero bundle impact"}}
{"run":21,"commit":"f01be7c","metric":1328,"metrics":{},"status":"discard","description":"browserslist modern targets — no change (Next.js 16 ignores it)","timestamp":1777641024609,"segment":0,"confidence":32,"asi":{"hypothesis":"browserslist targeting modern browsers would reduce polyfills (112KB)","result":"no change, Next.js 16 likely uses its own polyfill strategy regardless of browserslist"}}
